report_url,changes,updated_at
https://www.judiciary.uk/prevention-of-future-death-reports/trevor-monerville-prevention-of-future-deaths-report/,"{""date_of_report"":{""old"":"""",""new"":""16/01/2024""},""ref"":{""old"":"""",""new"":""2024-0025""},""deceased_name"":{""old"":"""",""new"":""Trevor Monerville""},""coroner_name"":{""old"":"""",""new"":""Rachel Redman""},""coroner_area"":{""old"":"""",""new"":""East Sussex""},""category"":{""old"":"""",""new"":""State Custody related deaths""},""this_report_is_being_sent_to"":{""old"":"""",""new"":""HM Prison and Probation Service | Practice Plus Group""},""pdf_url"":{""old"":"""",""new"":""https://www.judiciary.uk/wp-content/uploads/2024/01/Trevor-Monerville-Prevention-of-future-deaths-report-2024-0025_Published.pdf""},""circumstances"":{""old"":"""",""new"":""Trevor Monerville had been detained at HMP Lewes since 30.11.20. He was moved to M wing on 16.01.21.He was placed in a single cell and appeared settled and was part of the daily cleaning crew.   ""},""concerns"":{""old"":"""",""new"":""During the course of the investigation my inquiries revealed matters giving rise to concern. In my opinion there is a risk that future deaths could occur unless action is taken. In the circumstances it is my statutory duty to report to you.\n \nThe MATTERS OF CONCERN are as follows:\n \nConsideration should be given to the review of the treatment, monitoring and management of patients with a history of epilepsy or seizures by both the prison staff and healthcare staff. In particular, there was no seizure care plan, no seizure diary and once the ACCT had closed on 10th March 2021, there was no formal mechanism of monitoring Trevor’s condition. Further, the ACCT is not a suitable mechanism for such monitoring. The CSRA policy is designed to protect other prisoners, but not those who suffer from medical conditions as Trevor suffered. PPG in their evidence to be considered relating to PFD matters state that a care plan dashboard is now in place at HMP Lewes but this does not appear to be individualized or tailored to the prisoner’s clinical requirements.\n \nCommunication between healthcare and prison staff especially when Trevor was returned to the wing, between the prison staff and family, briefing by prison managers to officers on the wing about Trevor’s condition were all inadequate.\n \nEvidence was heard about the lack of integration of various IT systems which contributed to poor communication. In spite of the evidence from PPG regarding the sensitivity of medical records which should not be disclosed to the prison staff, I remain concerned that there was no effective monitoring and management of Trevor on the wing once the ACCT was closed. There was no mechanism in place for prison and healthcare staff to report their concerns about Trevor’s non compliance with taking his medication to Security, thus preventing the cell from being searched for retained medication.\n \nThere was a lack of training of prison staff in dealing with long term health conditions such as epilepsy on the wings. I understand there is a deficit in national policy within the prison service to manage and support prisoners with epilepsy and seizures.""},""inquest"":{""old"":"""",""new"":""On 22 April 2021 I commenced an investigation into the death of Trevor Alan MONERVILLE aged 33.   The investigation concluded at the end of the inquest on 25 September 2023.   ""},""action"":{""old"":"""",""new"":""In my opinion action should be taken to prevent future deaths and I believe you (and/or your organisation) have the power to take such action.""},""response"":{""old"":"""",""new"":""You are under a duty to respond to this report within 56 days of the date of this report, namely by March 07, 2024. I, the coroner, may extend the period.\n \nYour response must contain details of action taken or proposed to be taken, setting out the timetable for action. Otherwise you must explain why no action is proposed.""},""legal"":{""old"":"""",""new"":""I make this report under paragraph 7, Schedule 5, of the Coroners and Justice Act 2009 and regulations 28 and 29 of the Coroners (Investigations) Regulations 2013.""}}",2024-01-23T08:58:19.675Z
https://www.judiciary.uk/prevention-of-future-death-reports/nicholas-dymond-prevention-of-future-deaths-report/,"{""date_of_report"":{""old"":"""",""new"":""21/12/2023""},""ref"":{""old"":"""",""new"":""2023-0545""},""deceased_name"":{""old"":"""",""new"":""Nicholas Dymond""},""coroner_name"":{""old"":"""",""new"":""Alison Longhorn""},""coroner_area"":{""old"":"""",""new"":""Exeter and Greater Devon""},""category"":{""old"":"""",""new"":""Railway related deaths""},""this_report_is_being_sent_to"":{""old"":"""",""new"":""Devon Partnership NHS Trust""},""pdf_url"":{""old"":"""",""new"":""https://www.judiciary.uk/wp-content/uploads/2023/12/Nicholas-Dymond-Prevention-of-future-deaths-report-2023-0545_Published.pdf""},""circumstances"":{""old"":"""",""new"":""Nicholas Dymond had been an intermittent drug user for much of his adult life. In 2018 he began to suffer from paranoia and by October that year he had started to express thoughts of suicide – specifically of jumping in front of a train. His GP referred him to the Mental Health Crisis Team.   Following Nicholas’ arrest on 31st October 2018, a Mental Health Act Assessment was carried out. He was discharged and a taxi was arranged to take him home. On arrival of the taxi, Nicholas ran away. He was seen less than 3 hours later to step in front of a train at a local train station. He was pronounced deceased at the scene.""},""concerns"":{""old"":"""",""new"":""During the course of the inquest the evidence revealed matters giving rise to concern. In my opinion there is a risk that future deaths could occur unless action is taken. In the circumstances it is my statutory duty to report to you.\nThe MATTERS OF CONCERN are as follows:\nThe inquest heard that independent doctors did not have access to the CareNotes and relied upon printed copies of extracts from the notes which the AMHP considered pertinent to the Mental Health Act Assessment. Training is now available for independent s.12 doctors which, once completed, allows them access to CareNotes, but this training is not a mandated condition of their inclusion on the list of approved s.12 doctors. There remains a risk that, should a Trust doctor not be available to conduct the assessment, an independent doctor with no access to the patient’s records would be called upon to conduct an assessment.""},""inquest"":{""old"":"""",""new"":""On 13 November 2018 an investigation was commenced into the death of Nicholas James Glavind Dymond. The investigation concluded at the end of the inquest on 19 June 2023. The conclusion of the inquest was suicide. ""},""action"":{""old"":"""",""new"":""In my opinion action should be taken to prevent future deaths and I believe that you and your organisation has the power to take such action.""},""response"":{""old"":"""",""new"":""You are under a duty to respond to this report within 56 days of the date of this report, namely by 22 February 2023. I, the coroner, may extend the period.""},""legal"":{""old"":"""",""new"":""I make this report under paragraph 7, Schedule 5, of the Coroners and Justice Act 2009 and Regulations 28 and 29 of the Coroners (Investigations) Regulations 2013.""}}",2024-01-23T08:58:19.675Z
https://www.judiciary.uk/prevention-of-future-death-reports/james-campion-prevention-of-future-deaths-report/,"{""date_of_report"":{""old"":"""",""new"":""20/12/2023""},""ref"":{""old"":"""",""new"":""2023-0539""},""deceased_name"":{""old"":"""",""new"":""James Campion""},""coroner_name"":{""old"":"""",""new"":""Anita Bhardwaj""},""coroner_area"":{""old"":"""",""new"":""Liverpool and Wirral""},""category"":{""old"":"""",""new"":""Alcohol, drug and medication related deaths | Emergency services related deaths (2019 onwards)""},""this_report_is_being_sent_to"":{""old"":"""",""new"":""Department of Health and Social Care | NHS Improvement | NHS England""},""pdf_url"":{""old"":"""",""new"":""https://www.judiciary.uk/wp-content/uploads/2023/12/James-Campion-Prevention-of-future-deaths-report-2023-0539_Published.pdf""},""circumstances"":{""old"":"""",""new"":""James Campion was 57 year old gentleman who had a number of co-morbidities, including a history of depression and previous drug overdoses. Mr Campion was also known to drink alcohol to excess, described by family as a functioning alcoholic. On 1 July 2022 Mr Campion contacted the crisis teams indicated he was going to overdose and then proceeded to overdose on prescription medication. He was conveyed to the Royal Liverpool University Hospital where he was treated for the overdose and seen by the mental health team. A mental health assessment was not carried out and he was discharged with the advice to contact the crisis team if needed. On the evening of 20 July 2022 Mr Campion spoke to a friend who confirms Mr Campion appeared intoxicated but appeared to be his normal self. In the early hours of 21 July 2022, Mr Campion made contact with the Psychiatric Crisis Team threatening to take an overdose of [REDACTED] and his heart medication, he also stated that he had been drinking vodka. In the light of their concerns the Crisis Team contacted the North West Ambulance Service (NWAS) by 999 at 2.10am. The initial call was allocated a category III classification (attendance within one hour and 90% of calls within two hours). The Service was stated to be very busy at that time. It was four and a half hours from the original call before the case was reviewed by a clinician but there does not appear to have been a welfare check phone call at that time. It was not until six hours after the initial call that an ambulance was allocated and when the crew arrived at his home address at 8:26am they found Mr Campion deceased in the living room. The post mortem and toxicology investigation found the cause of death to be mirtazapine and alcohol toxicity. Mirtazapine is an antidepressant medication and has a number of common side- effects including feeling sleepy and in overdose it can lead to reduced consciousness and coma. The TOXBASE guidance notes that peak plasma concentrations occur approximately two hours after ingestion. It also states that the effects on the central nervous system may be enhanced or prolonged following co-ingestion of other central nervous system depressants including alcohol. Though it is unknown as to exactly what time Mr Campion took the overdose of mirtazapine, in the opinion of the expert the delay of over 6 hours from the initial call to the ambulance service to an ambulance crew being allocated and arriving on scene is very significant. It is more likely than not if Mr Campion had been in hospital at a point at least two hours after ingestion he would have survived this event. There were a number of missed opportunities in the care and treatment of Mr Campion. The family contact details noted by the mental health team were incorrect. There was very little evidence of family involvement throughout the mental health interactions, this being a critical and crucial element of the mental heath treatment plan. On 1 July 2022 a full mental health assessment should have been carried out, which is likely to have resulted in immediate support for Mr Campion and measures been put in place for further referrals to the appropriate mental health services. On 21 July 2022 the ambulance call handler did not give the time estimate of the ambulance to the crisis team member; that said the numbers for the family were incorrect and so would not have led to anyone being contacted. The delay in the ambulance dispatch prevented Mr Campion receiving medical treatment and further psychiatric assistance. The outcome for Mr Campion has been adversely impacted due to the  demand on the ambulance service . At the time of the 999 call on 21st July 2022 NWAS were operating at Level 4 of the Plan (PSP) experiencing high demand, acute pressures and high numbers of waiting calls. The options for the emergency services were extremely limited and an ambulance was deployed at the earliest opportunity. Mr Campion clearly consumed an excessive amount of prescription medication whilst under the influence of alcohol and as such his state of mind is likely to have been impaired. Taking account of his past actions, particularly that of 1st July 2022, it is more likely than not he carried out the act not with the intention of taking his own life.""},""concerns"":{""old"":"""",""new"":""During the course of the investigation my inquiries revealed matters giving rise to concern. In my opinion there is a risk that future deaths could occur unless action is taken. In the circumstances it is my statutory duty to report to you.\n \nThe MATTERS OF CONCERN are as follows:\n(brief summary of matters of concern)\n \nThe delay in triaging the call made by Mr Campion threatening to take an overdose resulted in him taking the overdose. The delay in the ambulance dispatch prevented Mr Campion receiving medical treatment and further psychiatric assistance. The outcome for Mr Campion has been adversely impacted due to the demand on the ambulance service . At the time of the 999 call on 21st July 2022 NWAS were operating at Level 4 of the Plan (PSP) experiencing high demand, acute pressures and high numbers of waiting calls. The options for the emergency services were extremely limited and an ambulance was deployed at the earliest opportunity. Consideration be given to how to support the Ambulance and Mental Health Services in fulfilling the NHS long-term plan for Mental Health, in particular Mental Health Practitioners in Ambulance control rooms.""},""inquest"":{""old"":"""",""new"":""On 02 August 2022 I commenced an investigation into the death of James CAMPION aged 57. The investigation concluded at the end of the inquest on 19 December 2023. The conclusion of the inquest was that:   ""},""action"":{""old"":"""",""new"":""In my opinion action should be taken to prevent future deaths and I believe you (and/or your organisation) have the power to take such action.""},""response"":{""old"":"""",""new"":""You are under a duty to respond to this report within 56 days of the date of this report, namely by February 13, 2024. I, the coroner, may extend the period.\n \nYour response must contain details of action taken or proposed to be taken, setting out the timetable for action. Otherwise you must explain why no action is proposed.""},""legal"":{""old"":"""",""new"":""I make this report under paragraph 7, Schedule 5, of the Coroners and Justice Act 2009 and regulations 28 and 29 of the Coroners (Investigations) Regulations 2013.""}}",2024-01-23T08:58:19.675Z
https://www.judiciary.uk/prevention-of-future-death-reports/john-taylor-prevention-of-future-deaths-report/,"{""date_of_report"":{""old"":"""",""new"":""15/12/2023""},""ref"":{""old"":"""",""new"":""2023-0525""},""deceased_name"":{""old"":"""",""new"":""John Taylor""},""coroner_name"":{""old"":"""",""new"":""Clare Bailey""},""coroner_area"":{""old"":"""",""new"":""Teeside and Hartlepool""},""category"":{""old"":"""",""new"":""Emergency services related deaths (2019 onwards)""},""this_report_is_being_sent_to"":{""old"":"""",""new"":""North East Ambulance Service NHS Foundation Trust""},""pdf_url"":{""old"":"""",""new"":""https://www.judiciary.uk/wp-content/uploads/2023/12/John-Taylor-Prevention-of-future-deaths-report-2023-0525_Published.pdf""},""circumstances"":{""old"":"""",""new"":""Mr Taylor contacted the fire brigades befriend service on 18.07.22 expressing suicidal intent and plans. The fire brigade contacted Cleveland police who is turn contacted NEAS at 1557 on that day. After 3 unsuccessful attempts to speak with Mr Taylor, contact was made at 1610 by a call handler. The matter was assessed as requiring a Category 3 response. The ambulance arrived at Mr Taylor’s home at 0523 on 19.07.22, occasioning a delay of over 13 hours. The paramedic tried the door, but access could not be gained. At 0543 a request was to the police to gain entry. The police arrived on scene at 0558. When the police arrived, they noted that the door was unlocked and that the ambulances hadn’t tried the handle. They gained access to the property within one minute. Care and attention were provided to Mr Taylor, and he was transported to UHNT. He died on 27.07.22.""},""concerns"":{""old"":"""",""new"":""During the course of the investigation my inquiries revealed matters giving rise to concern. In my opinion there is a risk that future deaths could occur unless action is taken. In the circumstances it is my statutory duty to report to you.\n \nThe MATTERS OF CONCERN are as follows:\n1. The attending paramedics had not adequately checked the door handle. It was unlocked. As a result, they waited an extra 30 minutes for the police to arrive in order to gain entry.""},""inquest"":{""old"":"""",""new"":""On 29 July 2022 I commenced an investigation into the death of John Robert TAYLOR aged 35. The investigation concluded at the end of the inquest on 07 December 2023. The conclusion of the inquest was that:   ""},""action"":{""old"":"""",""new"":""In my opinion action should be taken to prevent future deaths and I believe you [REDACTED], Chief Executive North East Ambulance Service NHS Foundation Trust Bernicia House Goldcrest Way Newburn Riverside Newcastle upon Tyne NE15 8NY have the power to take such action.""},""response"":{""old"":"""",""new"":""You are under a duty to respond to this report within 56 days of the date of this report, namely by February 09, 2024. I, the coroner, may extend the period.\n \nYour response must contain details of action taken or proposed to be taken, setting out the timetable for action. Otherwise you must explain why no action is proposed.""},""legal"":{""old"":"""",""new"":""I make this report under paragraph 7, Schedule 5, of the Coroners and Justice Act 2009 and regulations 28 and 29 of the Coroners (Investigations) Regulations 2013.""}}",2024-01-23T08:58:19.675Z
https://www.judiciary.uk/prevention-of-future-death-reports/katie-williams-prevention-of-future-deaths-report/,"{""date_of_report"":{""old"":"""",""new"":""24/11/2023""},""ref"":{""old"":"""",""new"":""2023-0512""},""deceased_name"":{""old"":"""",""new"":""Katie Williams""},""coroner_name"":{""old"":"""",""new"":""Louise Wiltshire""},""coroner_area"":{""old"":"""",""new"":""Plymouth, Torbay and South Devon""},""category"":{""old"":"""",""new"":""Alcohol, drug and medication related deaths | Suicide (from 2015)""},""this_report_is_being_sent_to"":{""old"":"""",""new"":""Intensive Care Medicine""},""pdf_url"":{""old"":"""",""new"":""https://www.judiciary.uk/wp-content/uploads/2023/12/Katie-Williams-Prevention-of-future-deaths-report-2023-0512_Published.pdf""},""reply_urls"":{""old"":"""",""new"":""https://www.judiciary.uk/wp-content/uploads/2023/12/2023-0512-Response-from-University-Hospitals-Plymouth-NHS-Trust.pdf""},""circumstances"":{""old"":"""",""new"":""On 15 May 2021 Katie Anne WILLIAMS took an overdose of her prescribed\n[REDACTED].  She had taken [RED CTED] modified release tablets.\nEquivalent to 56 days’ worth of this prescribed medication.\n \nShe was taken to Derriford Hospital by ambulance in the early hours of 16 May 2021 where she was reviewed in the emergency department and then shortly afterwards admitted to ICU.\n \nOn arrival at the emergency department, Katie was recognised to be extremely unwell. She was unconscious with a GCS of 3 as a result of her overdose. She had also had a number of seizures on her way to the hospital, and prior to the ambulance arrival. She required intubation and ventilation to protect her airway and stabilise her condition.\n \nA chest x-ray was undertaken which demonstrated evidence of an aspiration. Katie also had a temperature of 40°c on admission to the emergency department; this, and the evidence of early muscle injury, led the treating ICU team to conclude that Kate was likely to be suffering with serotonin toxicity.\n \nGiven the ongoing risk of serotonin toxicity, and following Toxbase advice, no infusion of the opiate drug [REDACTED was administered to Katie during days 1, 2 or 3 of her ICU admission. At this stage, the venlafaxine was felt to still to be her system, and the plan was to support Katie whilst this cleared, and to treat her evolving aspiration pneumonia with antibiotics. Where additional sedation was required remifentanil was used.\n \nOn day 4 of Katie‘s ICU admission (19 May 2021) a decision was made to switch the remifentanil infusion to a [REDACTED] infusion as per usual ICU practice. In the following days Katie‘s kidney function continue to normalise. There was no recurrence of a hyperpyrexia, or any other clinical features to suggest a recurrence of the serotonin syndrome.""},""concerns"":{""old"":"""",""new"":""During the course of the inquest the evidence revealed matters giving rise to concern. In my opinion there is a risk that future deaths will occur unless action is taken. In the circumstances it is my statutory duty to report to you.\n \nThe MATTERS OF CONCERN are as follows.\nThe administration of [REDACTED] from day four of Katie’s hospital admission reprecipitated her serotonin syndrome and directly contributed to her death. The Trust has recognised this and amended its sedation policy to recommend “lower risk” opiates (such as morphine) are used in patients who have taken overdoses of medications where there is a risk of serotonin syndrome / toxicity.\n \nIt is accepted that the way the [REDACTED] interacted in this case was unexpected, and appears to have occurred due to the particular circumstances of Katie’s case; in particular an aspiration pneumonia requiring treatment in the prone position, and the development of a paralytic ileus. However, these complications are not unusual in patients who have taken overdoses of these types of medications and as such I consider there is a risk a future death may occur in similar circumstances.\n \nI am concerned that other NHS organisations may not fully appreciate the risks associated with the use of [REDACTED] in patients such as Katie and that this information should be shared with those organisations on a national level.""},""inquest"":{""old"":"""",""new"":""On 11 June 2021 an inquest was opened touching the death of Katie Anne WILLIAMS (aged 45) who died at Derriford Hospital in Plymouth on 24 May 2021. She died having taken intentional overdose of [REDACTED] on 15 May 2021, and as a result of subsequent hospital care and treatment provided to her for that overdose and associated complications.   ""},""action"":{""old"":"""",""new"":""In my opinion action should be taken to prevent future deaths and I believe your organisation has the power to take such action.""},""response"":{""old"":"""",""new"":""You are under a duty to respond to this report within 56 days of the date of this report, namely by 5 January 2024. I, the coroner, may extend the period.\n \nYour response must contain details of action taken or proposed to be taken, setting out the timetable for action. Otherwise you must explain why no action is proposed.""},""legal"":{""old"":"""",""new"":""I make this report under paragraph 7, Schedule 5, of the Coroners and Justice Act 2009 and regulations 28 and 29 of the Coroners (Investigations) Regulations 2013. \nhttp://www.legislation.gov.uk/ukpga/2009/25/schedule/5/paragraph/7 \nhttp://www.legislation.gov.uk/uksi/2013/1629/part/7/made""}}",2024-01-23T08:58:19.675Z
